{
  "$otSharedSchema": "#/protocol/schemas/7",
  "schemaVersion": 7,
  "metadata": {
    "protocolName": "Simple test protocol",
    "author": "engineering <engineering@opentrons.com>",
    "description": "A short test protocol",
    "created": 1223131231,
    "tags": ["unitTest"]
  },
  "robot": {
    "model": "OT-2 Standard",
    "deckId": "ot2_standard"
  },
  "liquids": {
    "waterId": {
      "displayName": "Water",
      "description": "Liquid H2O",
      "displayColor": "#7332a8"
    }
  },
  "labwareDefinitions": {
    "opentrons/opentrons_1_trash_1100ml_fixed/1": {
      "ordering": [["A1"]],
      "metadata": {
        "displayCategory": "trash",
        "displayVolumeUnits": "mL",
        "displayName": "Opentrons Fixed Trash",
        "tags": []
      },
      "schemaVersion": 2,
      "version": 1,
      "namespace": "opentrons",
      "dimensions": {
        "xDimension": 172.86,
        "yDimension": 165.86,
        "zDimension": 82
      },
      "parameters": {
        "format": "trash",
        "isTiprack": false,
        "loadName": "opentrons_1_trash_1100ml_fixed",
        "isMagneticModuleCompatible": false,
        "quirks": ["fixedTrash", "centerMultichannelOnWells"]
      },
      "wells": {
        "A1": {
          "shape": "rectangular",
          "yDimension": 165.67,
          "xDimension": 107.11,
          "totalLiquidVolume": 1100000,
          "depth": 77,
          "x": 82.84,
          "y": 53.56,
          "z": 5
        }
      },
      "brand": {
        "brand": "Opentrons"
      },
      "groups": [
        {
          "wells": ["A1"],
          "metadata": {}
        }
      ],
      "cornerOffsetFromSlot": {
        "x": 0,
        "y": 0,
        "z": 0
      }
    },
    "opentrons/opentrons_96_tiprack_10ul/1": {
      "ordering": [
        ["A1", "B1", "C1", "D1", "E1", "F1", "G1", "H1"],
        ["A2", "B2", "C2", "D2", "E2", "F2", "G2", "H2"],
        ["A3", "B3", "C3", "D3", "E3", "F3", "G3", "H3"],
        ["A4", "B4", "C4", "D4", "E4", "F4", "G4", "H4"],
        ["A5", "B5", "C5", "D5", "E5", "F5", "G5", "H5"],
        ["A6", "B6", "C6", "D6", "E6", "F6", "G6", "H6"],
        ["A7", "B7", "C7", "D7", "E7", "F7", "G7", "H7"],
        ["A8", "B8", "C8", "D8", "E8", "F8", "G8", "H8"],
        ["A9", "B9", "C9", "D9", "E9", "F9", "G9", "H9"],
        ["A10", "B10", "C10", "D10", "E10", "F10", "G10", "H10"],
        ["A11", "B11", "C11", "D11", "E11", "F11", "G11", "H11"],
        ["A12", "B12", "C12", "D12", "E12", "F12", "G12", "H12"]
      ],
      "brand": {
        "brand": "Opentrons",
        "brandId": [],
        "links": [
          "https://shop.opentrons.com/collections/opentrons-tips/products/opentrons-10ul-tips"
        ]
      },
      "metadata": {
        "displayName": "Opentrons 96 Tip Rack 10 µL",
        "displayCategory": "tipRack",
        "displayVolumeUnits": "µL",
        "tags": []
      },
      "dimensions": {
        "xDimension": 127.76,
        "yDimension": 85.48,
        "zDimension": 64.69
      },
      "wells": {
        "A1": {
          "depth": 39.2,
          "shape": "circular",
          "diameter": 3.27,
          "totalLiquidVolume": 10,
          "x": 14.38,
          "y": 74.24,
          "z": 25.49
        },
        "B1": {
          "depth": 39.2,
          "shape": "circular",
          "diameter": 3.27,
          "totalLiquidVolume": 10,
          "x": 14.38,
          "y": 65.24,
          "z": 25.49
        },
        "C1": {
          "depth": 39.2,
          "shape": "circular",
          "diameter": 3.27,
          "totalLiquidVolume": 10,
          "x": 14.38,
          "y": 56.24,
          "z": 25.49
        },
        "D1": {
          "depth": 39.2,
          "shape": "circular",
          "diameter": 3.27,
          "totalLiquidVolume": 10,
          "x": 14.38,
          "y": 47.24,
          "z": 25.49
        },
        "E1": {
          "depth": 39.2,
          "shape": "circular",
          "diameter": 3.27,
          "totalLiquidVolume": 10,
          "x": 14.38,
          "y": 38.24,
          "z": 25.49
        },
        "F1": {
          "depth": 39.2,
          "shape": "circular",
          "diameter": 3.27,
          "totalLiquidVolume": 10,
          "x": 14.38,
          "y": 29.24,
          "z": 25.49
        },
        "G1": {
          "depth": 39.2,
          "shape": "circular",
          "diameter": 3.27,
          "totalLiquidVolume": 10,
          "x": 14.38,
          "y": 20.24,
          "z": 25.49
        },
        "H1": {
          "depth": 39.2,
          "shape": "circular",
          "diameter": 3.27,
          "totalLiquidVolume": 10,
          "x": 14.38,
          "y": 11.24,
          "z": 25.49
        },
        "A2": {
          "depth": 39.2,
          "shape": "circular",
          "diameter": 3.27,
          "totalLiquidVolume": 10,
          "x": 23.38,
          "y": 74.24,
          "z": 25.49
        },
        "B2": {
          "depth": 39.2,
          "shape": "circular",
          "diameter": 3.27,
          "totalLiquidVolume": 10,
          "x": 23.38,
          "y": 65.24,
          "z": 25.49
        },
        "C2": {
          "depth": 39.2,
          "shape": "circular",
          "diameter": 3.27,
          "totalLiquidVolume": 10,
          "x": 23.38,
          "y": 56.24,
          "z": 25.49
        },
        "D2": {
          "depth": 39.2,
          "shape": "circular",
          "diameter": 3.27,
          "totalLiquidVolume": 10,
          "x": 23.38,
          "y": 47.24,
          "z": 25.49
        },
        "E2": {
          "depth": 39.2,
          "shape": "circular",
          "diameter": 3.27,
          "totalLiquidVolume": 10,
          "x": 23.38,
          "y": 38.24,
          "z": 25.49
        },
        "F2": {
          "depth": 39.2,
          "shape": "circular",
          "diameter": 3.27,
          "totalLiquidVolume": 10,
          "x": 23.38,
          "y": 29.24,
          "z": 25.49
        },
        "G2": {
          "depth": 39.2,
          "shape": "circular",
          "diameter": 3.27,
          "totalLiquidVolume": 10,
          "x": 23.38,
          "y": 20.24,
          "z": 25.49
        },
        "H2": {
          "depth": 39.2,
          "shape": "circular",
          "diameter": 3.27,
          "totalLiquidVolume": 10,
          "x": 23.38,
          "y": 11.24,
          "z": 25.49
        },
        "A3": {
          "depth": 39.2,
          "shape": "circular",
          "diameter": 3.27,
          "totalLiquidVolume": 10,
          "x": 32.38,
          "y": 74.24,
          "z": 25.49
        },
        "B3": {
          "depth": 39.2,
          "shape": "circular",
          "diameter": 3.27,
          "totalLiquidVolume": 10,
          "x": 32.38,
          "y": 65.24,
          "z": 25.49
        },
        "C3": {
          "depth": 39.2,
          "shape": "circular",
          "diameter": 3.27,
          "totalLiquidVolume": 10,
          "x": 32.38,
          "y": 56.24,
          "z": 25.49
        },
        "D3": {
          "depth": 39.2,
          "shape": "circular",
          "diameter": 3.27,
          "totalLiquidVolume": 10,
          "x": 32.38,
          "y": 47.24,
          "z": 25.49
        },
        "E3": {
          "depth": 39.2,
          "shape": "circular",
          "diameter": 3.27,
          "totalLiquidVolume": 10,
          "x": 32.38,
          "y": 38.24,
          "z": 25.49
        },
        "F3": {
          "depth": 39.2,
          "shape": "circular",
          "diameter": 3.27,
          "totalLiquidVolume": 10,
          "x": 32.38,
          "y": 29.24,
          "z": 25.49
        },
        "G3": {
          "depth": 39.2,
          "shape": "circular",
          "diameter": 3.27,
          "totalLiquidVolume": 10,
          "x": 32.38,
          "y": 20.24,
          "z": 25.49
        },
        "H3": {
          "depth": 39.2,
          "shape": "circular",
          "diameter": 3.27,
          "totalLiquidVolume": 10,
          "x": 32.38,
          "y": 11.24,
          "z": 25.49
        },
        "A4": {
          "depth": 39.2,
          "shape": "circular",
          "diameter": 3.27,
          "totalLiquidVolume": 10,
          "x": 41.38,
          "y": 74.24,
          "z": 25.49
        },
        "B4": {
          "depth": 39.2,
          "shape": "circular",
          "diameter": 3.27,
          "totalLiquidVolume": 10,
          "x": 41.38,
          "y": 65.24,
          "z": 25.49
        },
        "C4": {
          "depth": 39.2,
          "shape": "circular",
          "diameter": 3.27,
          "totalLiquidVolume": 10,
          "x": 41.38,
          "y": 56.24,
          "z": 25.49
        },
        "D4": {
          "depth": 39.2,
          "shape": "circular",
          "diameter": 3.27,
          "totalLiquidVolume": 10,
          "x": 41.38,
          "y": 47.24,
          "z": 25.49
        },
        "E4": {
          "depth": 39.2,
          "shape": "circular",
          "diameter": 3.27,
          "totalLiquidVolume": 10,
          "x": 41.38,
          "y": 38.24,
          "z": 25.49
        },
        "F4": {
          "depth": 39.2,
          "shape": "circular",
          "diameter": 3.27,
          "totalLiquidVolume": 10,
          "x": 41.38,
          "y": 29.24,
          "z": 25.49
        },
        "G4": {
          "depth": 39.2,
          "shape": "circular",
          "diameter": 3.27,
          "totalLiquidVolume": 10,
          "x": 41.38,
          "y": 20.24,
          "z": 25.49
        },
        "H4": {
          "depth": 39.2,
          "shape": "circular",
          "diameter": 3.27,
          "totalLiquidVolume": 10,
          "x": 41.38,
          "y": 11.24,
          "z": 25.49
        },
        "A5": {
          "depth": 39.2,
          "shape": "circular",
          "diameter": 3.27,
          "totalLiquidVolume": 10,
          "x": 50.38,
          "y": 74.24,